{
  "$schema": "https://json-schema.org/draft/2020-12/schema",
  "type": "object",
  "properties": {
    "id": {
      "type": "string",
      "pattern": "^.+__.+$"
    },
    "line": {
      "type": "string",
      "minLength": 1
    },
    "from_station": {
      "type": "string",
      "minLength": 1
    },
    "to_station": {
      "type": "string",
      "minLength": 1
    },
    "geometry": {
      "anyOf": [
        {
          "type": "object",
          "properties": {
            "type": {
              "type": "string",
              "const": "LineString"
            },
            "coordinates": {
              "minItems": 2,
              "type": "array",
              "items": {
                "type": "array",
                "prefixItems": [
                  {
                    "type": "number",
                    "minimum": -180,
                    "maximum": 180
                  },
                  {
                    "type": "number",
                    "minimum": -90,
                    "maximum": 90
                  }
                ],
                "items": false,
                "minItems": 2,
                "maxItems": 2
              }
            }
          },
          "required": [
            "type",
            "coordinates"
          ],
          "additionalProperties": false
        },
        {
          "type": "null"
        }
      ]
    },
    "geometry_source": {
      "type": "string",
      "enum": [
        "osm",
        "manual",
        "straight"
      ]
    },
    "osm_way_refs": {
      "type": "array",
      "items": {
        "type": "integer",
        "exclusiveMinimum": 0,
        "maximum": 9007199254740991
      }
    },
    "validity": {
      "type": "array",
      "items": {
        "type": "object",
        "properties": {
          "from": {
            "type": "string",
            "format": "date",
            "pattern": "^(?:(?:\\d\\d[2468][048]|\\d\\d[13579][26]|\\d\\d0[48]|[02468][048]00|[13579][26]00)-02-29|\\d{4}-(?:(?:0[13578]|1[02])-(?:0[1-9]|[12]\\d|3[01])|(?:0[469]|11)-(?:0[1-9]|[12]\\d|30)|(?:02)-(?:0[1-9]|1\\d|2[0-8])))$"
          },
          "to": {
            "anyOf": [
              {
                "type": "string",
                "format": "date",
                "pattern": "^(?:(?:\\d\\d[2468][048]|\\d\\d[13579][26]|\\d\\d0[48]|[02468][048]00|[13579][26]00)-02-29|\\d{4}-(?:(?:0[13578]|1[02])-(?:0[1-9]|[12]\\d|3[01])|(?:0[469]|11)-(?:0[1-9]|[12]\\d|30)|(?:02)-(?:0[1-9]|1\\d|2[0-8])))$"
              },
              {
                "type": "null"
              }
            ]
          }
        },
        "required": [
          "from",
          "to"
        ],
        "additionalProperties": false
      }
    },
    "milestones": {
      "type": "array",
      "items": {
        "type": "object",
        "properties": {
          "date": {
            "type": "string",
            "format": "date",
            "pattern": "^(?:(?:\\d\\d[2468][048]|\\d\\d[13579][26]|\\d\\d0[48]|[02468][048]00|[13579][26]00)-02-29|\\d{4}-(?:(?:0[13578]|1[02])-(?:0[1-9]|[12]\\d|3[01])|(?:0[469]|11)-(?:0[1-9]|[12]\\d|30)|(?:02)-(?:0[1-9]|1\\d|2[0-8])))$"
          },
          "date_precision": {
            "type": "string",
            "enum": [
              "exact",
              "month",
              "year",
              "disputed"
            ]
          },
          "event": {
            "type": "string",
            "enum": [
              "construction_started",
              "trial_run",
              "opened",
              "extended",
              "renamed",
              "recoded",
              "suspended",
              "closed"
            ]
          },
          "line": {
            "type": "string",
            "minLength": 1
          },
          "source_refs": {
            "minItems": 1,
            "type": "array",
            "items": {
              "type": "object",
              "properties": {
                "url": {
                  "type": "string",
                  "format": "uri"
                },
                "title": {
                  "type": "string",
                  "minLength": 1
                },
                "published_at": {
                  "anyOf": [
                    {
                      "type": "string",
                      "format": "date",
                      "pattern": "^(?:(?:\\d\\d[2468][048]|\\d\\d[13579][26]|\\d\\d0[48]|[02468][048]00|[13579][26]00)-02-29|\\d{4}-(?:(?:0[13578]|1[02])-(?:0[1-9]|[12]\\d|3[01])|(?:0[469]|11)-(?:0[1-9]|[12]\\d|30)|(?:02)-(?:0[1-9]|1\\d|2[0-8])))$"
                    },
                    {
                      "type": "null"
                    }
                  ]
                }
              },
              "required": [
                "url",
                "title"
              ],
              "additionalProperties": false
            }
          }
        },
        "required": [
          "date",
          "date_precision",
          "event",
          "source_refs"
        ],
        "additionalProperties": false
      }
    },
    "confidence": {
      "type": "string",
      "enum": [
        "high",
        "medium",
        "low"
      ]
    },
    "last_verified_at": {
      "type": "string",
      "format": "date",
      "pattern": "^(?:(?:\\d\\d[2468][048]|\\d\\d[13579][26]|\\d\\d0[48]|[02468][048]00|[13579][26]00)-02-29|\\d{4}-(?:(?:0[13578]|1[02])-(?:0[1-9]|[12]\\d|3[01])|(?:0[469]|11)-(?:0[1-9]|[12]\\d|30)|(?:02)-(?:0[1-9]|1\\d|2[0-8])))$"
    }
  },
  "required": [
    "id",
    "line",
    "from_station",
    "to_station",
    "geometry",
    "geometry_source",
    "osm_way_refs",
    "validity",
    "milestones",
    "confidence",
    "last_verified_at"
  ],
  "additionalProperties": false
}
