{
  "id": "PK10__MT01",
  "line": "MRT_PINK",
  "from_station": "PK10",
  "to_station": "MT01",
  "geometry": {
    "type": "LineString",
    "coordinates": [
      [
        100.548487,
        13.897541
      ],
      [
        100.547616,
        13.897845
      ],
      [
        100.546981,
        13.897958
      ],
      [
        100.544515,
        13.898818
      ],
      [
        100.544347,
        13.898925
      ],
      [
        100.544222,
        13.899124
      ],
      [
        100.54421,
        13.899406
      ],
      [
        100.544372,
        13.899926
      ],
      [
        100.544363,
        13.900357
      ],
      [
        100.543762,
        13.902316
      ],
      [
        100.543673,
        13.903207
      ],
      [
        100.543776,
        13.907305
      ],
      [
        100.544248,
        13.910445
      ]
    ]
  },
  "geometry_source": "osm",
  "osm_way_refs": [
    1387844925,
    1387844926,
    766246138
  ],
  "validity": [
    {
      "from": "2025-06-17",
      "to": null
    }
  ],
  "milestones": [
    {
      "date": "2022-06-01",
      "date_precision": "month",
      "event": "construction_started",
      "source_refs": [
        {
          "url": "https://en.wikipedia.org/wiki/Pink_Line_(Bangkok)",
          "title": "Pink Line (Bangkok) - Wikipedia (free trial 21 November 2023, official launch 18 December 2023, revenue service 7 January 2024; Muang Thong Thani branch notice to proceed 20 June 2022, trial 20 May 2025)",
          "published_at": null
        }
      ]
    },
    {
      "date": "2025-05-20",
      "date_precision": "exact",
      "event": "trial_run",
      "source_refs": [
        {
          "url": "https://www.thaipbsworld.com/around-thailand/free-trail-of-pink-line%E2%80%99s-new-extension-runs-from-today-until-june-16th",
          "title": "Free trial of Pink Line's new extension runs from today until June 16th - Thai PBS World (commercial service from 17 June 2025)",
          "published_at": "2025-05-20"
        },
        {
          "url": "https://en.wikipedia.org/wiki/Pink_Line_(Bangkok)",
          "title": "Pink Line (Bangkok) - Wikipedia (free trial 21 November 2023, official launch 18 December 2023, revenue service 7 January 2024; Muang Thong Thani branch notice to proceed 20 June 2022, trial 20 May 2025)",
          "published_at": null
        }
      ]
    },
    {
      "date": "2025-06-17",
      "date_precision": "exact",
      "event": "opened",
      "source_refs": [
        {
          "url": "https://www.thaipbsworld.com/around-thailand/free-trail-of-pink-line%E2%80%99s-new-extension-runs-from-today-until-june-16th",
          "title": "Free trial of Pink Line's new extension runs from today until June 16th - Thai PBS World (commercial service from 17 June 2025)",
          "published_at": "2025-05-20"
        },
        {
          "url": "https://southeastasiainfra.com/muang-thong-thani-pink-line-extension-begins-commercial-operations/",
          "title": "Muang Thong Thani Pink Line Extension begins commercial operations - Southeast Asia Infrastructure (trial 20 May to 16 June 2025, commercial from 17 June 2025)",
          "published_at": "2025-06-19"
        }
      ]
    }
  ],
  "confidence": "medium",
  "last_verified_at": "2026-10-06"
}
