{
  "id": "S3__S4",
  "line": "BTS_SILOM",
  "from_station": "S3",
  "to_station": "S4",
  "geometry": {
    "type": "LineString",
    "coordinates": [
      [
        100.529306,
        13.723788
      ],
      [
        100.529981,
        13.722494
      ],
      [
        100.529987,
        13.722099
      ],
      [
        100.52985,
        13.7218
      ],
      [
        100.529422,
        13.721485
      ],
      [
        100.528231,
        13.721289
      ],
      [
        100.526683,
        13.720834
      ]
    ]
  },
  "geometry_source": "osm",
  "osm_way_refs": [
    157481737
  ],
  "validity": [
    {
      "from": "2021-02-08",
      "to": null
    }
  ],
  "milestones": [
    {
      "date": "2021-02-08",
      "date_precision": "exact",
      "event": "opened",
      "source_refs": [
        {
          "url": "https://www.bts.co.th/eng/info/info-history.html",
          "title": "BTS Skytrain - History (Bangkok Mass Transit System PCL)",
          "published_at": null
        },
        {
          "url": "https://en.wtmnews.net/20210208785",
          "title": "New station Saint Louis opens on February 8 - BTS Silom Line in Bangkok (code S4)",
          "published_at": "2021-02-08"
        }
      ]
    }
  ],
  "confidence": "medium",
  "last_verified_at": "2026-10-06"
}
