{
  "id": "N8__N9",
  "line": "BTS_SUKHUMVIT",
  "from_station": "N8",
  "to_station": "N9",
  "geometry": {
    "type": "LineString",
    "coordinates": [
      [
        100.553778,
        13.802615
      ],
      [
        100.558863,
        13.811355
      ],
      [
        100.559364,
        13.812369
      ],
      [
        100.560569,
        13.814245
      ],
      [
        100.561197,
        13.815479
      ],
      [
        100.561943,
        13.816725
      ]
    ]
  },
  "geometry_source": "osm",
  "osm_way_refs": [
    852283472,
    1449600342,
    1392013008
  ],
  "validity": [
    {
      "from": "2019-08-09",
      "to": null
    }
  ],
  "milestones": [
    {
      "date": "2019-08-09",
      "date_precision": "exact",
      "event": "opened",
      "source_refs": [
        {
          "url": "https://www.railjournal.com/passenger/metros/bangkok-sukhumvit-line-extension-inaugurated/",
          "title": "Bangkok Sukhumvit Line extension inaugurated - Mo Chit to Ha Yaek Lat Phrao, 9 August 2019",
          "published_at": null
        }
      ]
    }
  ],
  "confidence": "medium",
  "last_verified_at": "2026-09-01"
}
